{
  "administrative": {
    "report_id": "03abec2e-2c31-4ae5-b680-6e5ff7c1c332",
    "case_id": "DEMO-0001",
    "requesting_agency": "Demo Agency",
    "schema_version": "1.0.0",
    "created_at": "2026-07-21T09:50:11.799205+00:00",
    "software_version": "nextgen-forensics-scaffold-0.1.0"
  },
  "evidence": {
    "probe_image_id": "probe.png",
    "probe_image_hash": "b1efad8142d6bf44",
    "candidate_image_id": "candidate.png",
    "candidate_image_hash": "d88a05e0865d7201",
    "chain_of_custody_notes": ""
  },
  "image_metadata": {
    "filename": "probe.png",
    "width": 600,
    "height": 800,
    "format": "png",
    "capture_date": null
  },
  "quality_metrics": {
    "resolution": "600x800",
    "blur_score": 102.8,
    "noise": 0.28,
    "compression_artifact_score": 0.074,
    "brightness": 209.08,
    "contrast": 14.96,
    "lighting_uniformity": 1.0,
    "pose": {
      "yaw": -2.5,
      "pitch": -90.0,
      "roll": -0.59
    },
    "occlusion_score": 0.091,
    "face_visibility_pct": 90.9,
    "detection_confidence": 0.909
  },
  "face_detection": {
    "bounding_box": {
      "x": 109.80185866355896,
      "y": 202.7529239654541,
      "w": 382.70214200019836,
      "h": 455.15708923339844
    },
    "detection_confidence": 0.908702649488299,
    "model_name": "mock-detector-v0",
    "model_version": "n/a"
  },
  "landmarks": {
    "schema": "468",
    "model_name": "mock-landmarker-68",
    "model_version": "n/a",
    "points": [
      {
        "id": 0,
        "x": 315.4003143310547,
        "y": 518.2149887084961,
        "confidence": 0.8616665899753571
      },
      {
        "id": 1,
        "x": 315.42813777923584,
        "y": 458.0441474914551,
        "confidence": 0.8
      },
      {
        "id": 2,
        "x": 313.962721824646,
        "y": 476.12361907958984,
        "confidence": 0.8535143435001373
      },
      {
        "id": 3,
        "x": 300.1579999923706,
        "y": 401.95398330688477,
        "confidence": 0.8
      },
      {
        "id": 4,
        "x": 315.71359634399414,
        "y": 441.5677547454834,
        "confidence": 0.8
      },
      {
        "id": 5,
        "x": 315.3348684310913,
        "y": 418.53489875793457,
        "confidence": 0.8
      },
      {
        "id": 6,
        "x": 314.1637086868286,
        "y": 360.46104431152344,
        "confidence": 0.8366320878267288
      },
      {
        "id": 7,
        "x": 187.7797544002533,
        "y": 350.46210289001465,
        "confidence": 0.9870254406705499
      },
      {
        "id": 8,
        "x": 312.9652976989746,
        "y": 304.62865829467773,
        "confidence": 0.8708571046590805
      },
      {
        "id": 9,
        "x": 313.0793809890747,
        "y": 279.7427177429199,
        "confidence": 0.8536677062511444
      },
      {
        "id": 10,
        "x": 311.8565797805786,
        "y": 202.7529239654541,
        "confidence": 0.8806704208254814
      },
      {
        "id": 11,
        "x": 315.34337997436523,
        "y": 524.0617752075195,
        "confidence": 0.8699333071708679
      },
      {
        "id": 12,
        "x": 314.6418571472168,
        "y": 530.0841331481934,
        "confidence": 0.8882141560316086
      },
      {
        "id": 13,
        "x": 313.39244842529297,
        "y": 534.5254898071289,
        "confidence": 0.9124653190374374
      },
      {
        "id": 14,
        "x": 309.8487854003906,
        "y": 558.1762790679932,
        "confidence": 0.9290841296315193
      },
      {
        "id": 15,
        "x": 309.7085952758789,
        "y": 565.9727573394775,
        "confidence": 0.9230334311723709
      },
      {
        "id": 16,
        "x": 309.749436378479,
        "y": 575.6041049957275,
        "confidence": 0.9184411689639091
      },
      {
        "id": 17,
        "x": 309.1479778289795,
        "y": 585.0064754486084,
        "confidence": 0.9368869066238403
      },
      {
        "id": 18,
        "x": 309.647011756897,
        "y": 598.6791610717773,
        "confidence": 0.9982391216326505
      },
      {
        "id": 19,
        "x": 314.93003368377686,
        "y": 467.1785831451416,
        "confidence": 0.8
      },
      {
        "id": 20,
        "x": 299.90978837013245,
        "y": 467.98105239868164,
        "confidence": 0.810055747628212
      },
      {
        "id": 21,
        "x": 124.68457818031311,
        "y": 281.84423446655273,
        "confidence": 0.8
      },
      {
        "id": 22,
        "x": 234.59887504577637,
        "y": 367.44279861450195,
        "confidence": 0.9699836820363998
      },
      {
        "id": 23,
        "x": 218.40863227844238,
        "y": 369.555139541626,
        "confidence": 0.9717589169740677
      },
      {
        "id": 24,
        "x": 202.2663652896881,
        "y": 368.70150566101074,
        "confidence": 0.9830534365028143
      },
      {
        "id": 25,
        "x": 179.91101145744324,
        "y": 356.18391036987305,
        "confidence": 0.9790190309286118
      },
      {
        "id": 26,
        "x": 248.2496201992035,
        "y": 362.53085136413574,
        "confidence": 0.9825102854520082
      },
      {
        "id": 27,
        "x": 211.64429783821106,
        "y": 302.59203910827637,
        "confidence": 0.9454356953501701
      },
      {
        "id": 28,
        "x": 232.3289930820465,
        "y": 306.5216302871704,
        "confidence": 0.9487981088459492
      },
      {
        "id": 29,
        "x": 192.25814938545227,
        "y": 306.5188407897949,
        "confidence": 0.9589213319122791
      },
      {
        "id": 30,
        "x": 179.29272651672363,
        "y": 315.7879829406738,
        "confidence": 0.977035952731967
      },
      {
        "id": 31,
        "x": 166.76124930381775,
        "y": 368.0600166320801,
        "confidence": 0.9521846882998943
      },
      {
        "id": 32,
        "x": 245.2497124671936,
        "y": 613.6033058166504,
        "confidence": 0.9304059743881226
      },
      {
        "id": 33,
        "x": 181.56725764274597,
        "y": 343.12758445739746,
        "confidence": 0.9716417491436005
      },
      {
        "id": 34,
        "x": 116.98719263076782,
        "y": 357.47666358947754,
        "confidence": 0.8
      },
      {
        "id": 35,
        "x": 147.69548177719116,
        "y": 353.5648822784424,
        "confidence": 0.9061406403779984
      },
      {
        "id": 36,
        "x": 224.27907586097717,
        "y": 443.0454730987549,
        "confidence": 0.9371729418635368
      },
      {
        "id": 37,
        "x": 293.3111250400543,
        "y": 514.7367000579834,
        "confidence": 0.8627264201641083
      },
      {
        "id": 38,
        "x": 293.2953178882599,
        "y": 529.4392585754395,
        "confidence": 0.8914211094379425
      },
      {
        "id": 39,
        "x": 271.7439830303192,
        "y": 519.495677947998,
        "confidence": 0.892793282866478
      },
      {
        "id": 40,
        "x": 255.8790385723114,
        "y": 523.8662242889404,
        "confidence": 0.9370742961764336
      },
      {
        "id": 41,
        "x": 275.1248896121979,
        "y": 529.7515869140625,
        "confidence": 0.9112336710095406
      },
      {
        "id": 42,
        "x": 260.38593649864197,
        "y": 530.7759284973145,
        "confidence": 0.9520637542009354
      },
      {
        "id": 43,
        "x": 227.89741158485413,
        "y": 552.836799621582,
        "confidence": 0.956251859664917
      },
      {
        "id": 44,
        "x": 301.8636703491211,
        "y": 458.0057621002197,
        "confidence": 0.8
      },
      {
        "id": 45,
        "x": 299.60734248161316,
        "y": 441.71290397644043,
        "confidence": 0.8
      },
      {
        "id": 46,
        "x": 158.53654146194458,
        "y": 298.4447479248047,
        "confidence": 0.9837359674274921
      },
      {
        "id": 47,
        "x": 260.260409116745,
        "y": 397.7137088775635,
        "confidence": 0.9263961538672447
      },
      {
        "id": 48,
        "x": 262.6658856868744,
        "y": 453.38220596313477,
        "confidence": 0.8317865133285522
      },
      {
        "id": 49,
        "x": 260.67818999290466,
        "y": 444.14329528808594,
        "confidence": 0.8450157195329666
      },
      {
        "id": 50,
        "x": 171.66679501533508,
        "y": 440.453577041626,
        "confidence": 0.9936183877289295
      },
      {
        "id": 51,
        "x": 299.7245728969574,
        "y": 420.336389541626,
        "confidence": 0.8
      },
      {
        "id": 52,
        "x": 199.8892307281494,
        "y": 274.3593454360962,
        "confidence": 0.9066402614116669
      },
      {
        "id": 53,
        "x": 175.49545168876648,
        "y": 282.50584602355957,
        "confidence": 0.9417692124843597
      },
      {
        "id": 54,
        "x": 142.50022172927856,
        "y": 251.11517906188965,
        "confidence": 0.8825908750295639
      },
      {
        "id": 55,
        "x": 275.75817704200745,
        "y": 295.9249019622803,
        "confidence": 0.8787091076374054
      },
      {
        "id": 56,
        "x": 248.50139021873474,
        "y": 317.8330659866333,
        "confidence": 0.9671947695314884
      },
      {
        "id": 57,
        "x": 216.6126251220703,
        "y": 532.1197032928467,
        "confidence": 0.9591768644750118
      },
      {
        "id": 58,
        "x": 134.79706048965454,
        "y": 515.2104377746582,
        "confidence": 0.8
      },
      {
        "id": 59,
        "x": 274.6115505695343,
        "y": 463.576078414917,
        "confidence": 0.8557769805192947
      },
      {
        "id": 60,
        "x": 287.78101801872253,
        "y": 469.60062980651855,
        "confidence": 0.8618364185094833
      },
      {
        "id": 61,
        "x": 230.94148635864258,
        "y": 532.4429512023926,